{
  "description": "Centered threshold.",
  "expected_output_digest": "",
  "extensions": {
    "fixture.license": "CC0-1.0"
  },
  "fixture_ref": "inline://solutiongraph/benchmark/tabular-classification/centered",
  "id": "case.benchmark.tabular-classification.centered",
  "input_digest": "sha256:163cd43db342a365f74f4bd0ef1db110090ab3f75112c0fda62403d411dbe8b8",
  "split": "development",
  "tags": [
    "fixture.synthetic",
    "domain.ml",
    "task.classification"
  ],
  "task_model_version": "0.1"
}
